batch,start,end,records,pass,message
IWYIbDZIroKcaDDCOGcb,1974-01-24T22:25:37,2020-11-13T20:40:07,164,FALSE,Trouble network voice.
kHCfxsxvKzNPKPDcyNja,1974-09-20T18:16:42,2008-03-02T18:35:57,1935,TRUE,Saepe nostrum magnam beatae minima illo officia est.
wwapkdiLanFoNOtvuZSk,2012-07-27T13:59:40,2021-03-07T12:30:10,3040,FALSE,Month every way we fact.
aZJDAMucLjkxiAAznoUO,1996-11-27T19:33:01,2015-12-27T23:37:48,1080,TRUE,Everything machine just either up some move.
NJNJKcDkUjQHmcbdHDsy,2005-12-19T01:58:03,2017-03-26T21:19:02,8011,TRUE,デフォルト人形埋め込む編組器官文言。
BsFdgINUuKtpFpJhZode,1987-11-17T16:55:28,5964,7026,TRUE,Nemo eaque quod a sed.
LzetEaqHzazmOCDbBAjN,1992-09-09T17:08:04,1994-03-19T17:38:13,9694,FALSE,タワーキャビン証言する数字プラスチック近代化する。
SKKNzddMauPAkHcZxqAk,1971-03-18T16:00:02,2016-03-13T23:51:15,7865,FALSE,Any compare second think land maintain standard.
mcDrKddpUQVFiNLEZkrh,nyBuXWRMbQGsqvQntbAr,2019-11-30T09:58:43,6804,FALSE,今倫理屋根裏叔父今日パイオニア。
piblpbarPqGTojcNXDWF,1976-09-20T22:26:25,2008-04-01T20:51:25,8858,FALSE,叔父癌持っていました彼。
WCyhVxIvDiguokdogvvs,1987-08-24T14:47:02,1997-05-10T05:48:17,9359,FALSE,Excepturi fugit quae neque voluptatem dolorem aperiam.
wJjpDgiDxbvTdhzJlftm,1979-06-17T23:28:49,1981-05-01T02:53:13,4355,TRUE,World cut move media consider.
UukloVlUwfyRqnHGffPg,KCilwPmjpsnjfpZUfotR,2010-06-14T02:06:13,9895,TRUE,Accusantium magnam ex odio.
LadbPsiAPyWOzkPcofcW,1984-11-11T17:56:35,1985-12-10T21:37:54,3917,FALSE,Voluptas sapiente totam.
gVwFptnHpYDUTzylCSyo,1970-08-24T22:41:39,1975-03-21T14:04:37,3569,FALSE,Ducimus harum laudantium laudantium suscipit ab.
UZdAuRETuXIGOthsKhfP,1987-09-05T00:26:11,2010-06-19T18:42:54,7157,FALSE,Listen benefit its writer game behind enter.
YfUxttovDjnaqoVAUlQh,QdYWjmvKBwYrVGfZekME,2000-09-28T22:55:13,4626,FALSE,Distinctio libero iure necessitatibus.
hNqbmdsMDRnnfLEdFpXo,1994-11-12T17:39:04,1999-02-09T16:02:37,5135,FALSE,コンペサワー風景ソースないヘア見出しインチ。
TIzDaBZqaXwEbfbvruqD,1996-03-02T05:39:59,2009-04-21T05:43:14,3022,TRUE,Charge clearly care court much.
xLYEvjedsoIQtxYUnPHR,1982-02-06T11:11:41,2018-02-11T13:20:11,4452,FALSE,Laborum quae ducimus est veritatis assumenda.
gtHkNxmbKOqRePOgxfGG,1989-03-07T04:55:03,2006-12-13T02:02:00,7914,FALSE,Day attention gun sing her economy book.
KAZFNvkytcYUNnSqlZPK,1973-04-12T09:21:18,1982-02-14T13:55:07,2083,FALSE,Natus sint accusamus voluptatibus reiciendis quibusdam.
rcJgOSIwXvIXEeOrWLMq,1981-05-01T08:39:43,1990-06-03T11:06:46,9048,FALSE,Magnam necessitatibus sunt vel corporis.
QQzFQLidOlMicCvOEkLH,2013-07-24T08:56:59,2017-12-18T14:28:53,9321,TRUE,ないトスコミュニケーション月血まみれの屋根裏主人血まみれの。
KaOSKlZEfjLUaTHaTAAT,2019-07-30T22:33:38,2021-03-09T20:18:10,6145,LFGXyXYzvadJZaFyDlVN,Week structure front.
gKwmKPesGZLEXfKOsqJH,1995-11-01T15:44:18,2017-05-20T20:40:58,3743,FALSE,コピー呼ぶ電話敵対的な画面。
wNJKgJSzPpEHgHwhqeri,1981-02-08T15:31:26,1981-02-23T10:36:51,6637,FALSE,Health agent TV evidence wear husband idea.
vYdUHHcfqsYCPGjvzjDU,1978-03-24T00:08:00,2018-10-08T12:16:54,6497,TRUE,Move pretty event.
YGmKJbpvTuwXdpCHJWuK,2009-08-19T02:36:31,2020-01-09T00:45:33,1486,FALSE,敵対的な欠乏フェミニスト錯覚証言する発生する見落とす。
rLulcaQsBzQbXWswrDRK,1994-06-19T09:46:48,2002-09-29T17:50:54,4802,FALSE,Quis consequuntur recusandae repellat adipisci.
xgvSCtsYtHsWgRAZmEVJ,1973-11-02T22:57:02,1977-08-04T19:57:24,5403,TRUE,Molestias id voluptates sapiente culpa.
iuAxVxJpnUbsmBviZYSM,1970-02-20T15:50:52,1972-09-16T12:48:20,SNSXcWnnURTUsGvlchvX,TRUE,今転倒供給仕上げ人形。
xgodXPhqrbIjOphOnmhx,2015-12-14T01:56:24,2018-07-04T18:21:01,7822,TRUE,Door lay program describe particular effort.
XVzvsMOoKfZfugwYwWIV,1976-06-30T00:11:57,2016-07-22T18:15:23,8830,FALSE,Sequi error adipisci sequi culpa molestiae.
mfTKGYYMDyBtrLwTMKZE,1984-10-10T17:58:32,1986-12-09T17:53:21,1440,TRUE,Animi minus alias doloribus ut temporibus atque.
RwvNNoeVmjIdHoEuJeeW,1985-10-18T11:06:29,2017-09-08T11:32:34,1776,TRUE,同行ブランチ移動ない。
QFsklXUTULexjHVEWBKd,1979-03-09T01:53:09,2006-09-02T13:13:16,9084,TRUE,Totam ipsa nam voluptatem sit veritatis consectetur.
yPvhyWNGdjeLXDGDpFyC,1970-12-21T20:24:48,1984-04-03T09:11:43,6378,TRUE,Neque soluta nulla impedit commodi debitis fugit.
kyczLUJSEgMPAOdhLQHl,1974-04-23T09:52:00,2015-07-12T21:24:05,5786,FALSE,自体リハビリソース持っていましたカラム教会数字。
FTHNrNezWVmugiYrvoLF,1978-10-14T20:42:01,1987-02-08T23:42:29,5036,FALSE,バーゲン主婦追放する残る風景明らかにする。
uEkwMEhzxPNvgOfGzEoS,1982-06-07T11:31:34,1986-03-17T23:20:57,5848,FALSE,Represent change whom own either.
PtXbOKcUsGnBYGJPBtpN,2000-01-03T18:19:36,2004-07-04T18:42:23,4099,FALSE,Western require that soon particular just.
jigQZSQTTeWezyguvDHS,1977-03-31T08:06:40,2020-03-02T08:12:47,4182,FALSE,Appear affect interest exist his family necessary.
3561,2018-03-01T00:54:01,2020-07-10T03:00:45,637,FALSE,Police word Congress house opportunity what economy.
APYRwWrOtOthiuusFHSx,1992-03-02T21:03:15,2016-03-25T10:16:02,4472,TRUE,Energy piece house law.
tmoThtJPZsossGWXjUdz,1991-06-11T07:47:03,1998-12-29T21:20:30,1483,FALSE,Tempora aperiam vero doloribus et animi.